Title,ImageName,URL,TAG
Censored Anime Girl Illustration,"Sorry,-but-I-can't-assist-with-that._HmsUd.png","https://images.splitshire.com/full/Sorry,-but-I-can't-assist-with-that._HmsUd.png",girl
"Teenage Girl with Ponytail, Brown Eyes, and White Skin Wearing Hoodie",A-Teenage-Girl-with-Ponytail-in-a-Hoodie_BZHLY.png,https://images.splitshire.com/full/A-Teenage-Girl-with-Ponytail-in-a-Hoodie_BZHLY.png,girl
Crying Girl,The-Crying-Girl_G1NOl.png,https://images.splitshire.com/full/The-Crying-Girl_G1NOl.png,girl
Girls Sitting Beside River,The-Girls-Relaxing-by-the-River_TBdPB.png,https://images.splitshire.com/full/The-Girls-Relaxing-by-the-River_TBdPB.png,girl
Smiling Girl Holding Oranges on Orange Shades Background,A-Girl-Smiling-with-Oranges-in-her-Hands_3QU0W.png,https://images.splitshire.com/full/A-Girl-Smiling-with-Oranges-in-her-Hands_3QU0W.png,girl
Doctor Performing Girl's Skin Treatment,A-Doctor-Treating-a-Girl's-Skin_c14xL.png,https://images.splitshire.com/full/A-Doctor-Treating-a-Girl's-Skin_c14xL.png,girl
Doctor Performing Skin Treatment on Girl,A-Doctor-Treating-a-Girl's-Skin_z80tL.png,https://images.splitshire.com/full/A-Doctor-Treating-a-Girl's-Skin_z80tL.png,girl
Girl with Red Hood in Dark Ambient Lighting,A-Girl-with-Red-Hood-in-Dark-Ambiance_edyrB.png,https://images.splitshire.com/full/A-Girl-with-Red-Hood-in-Dark-Ambiance_edyrB.png,girl
Smiling Girl Riding Roller Skates,The-Girl-Roller-Skating-and-Smiling_SS1d1.png,https://images.splitshire.com/full/The-Girl-Roller-Skating-and-Smiling_SS1d1.png,girl
Smiling Girl Skating on Rollerblades,A-Girl-Smiling-While-Roller-Skating_GyVlx.png,https://images.splitshire.com/full/A-Girl-Smiling-While-Roller-Skating_GyVlx.png,girl
Topless Female Photo,The-Girl-Without-a-Top_HWYvv.png,https://images.splitshire.com/full/The-Girl-Without-a-Top_HWYvv.png,girl
Smiling Girl Roller Skating,A-Girl-Smiling-on-Roller-Skates_T45U9.png,https://images.splitshire.com/full/A-Girl-Smiling-on-Roller-Skates_T45U9.png,girl
Girl Swimming at Beach,A-Girl-Swimming-at-the-Beach_mg8u4.png,https://images.splitshire.com/full/A-Girl-Swimming-at-the-Beach_mg8u4.png,girl
Girl Examining Summer Kulirka Fabric,Girl-Examining-Summer-Fabric-in-Her-Hands_ecKCU.png,https://images.splitshire.com/full/Girl-Examining-Summer-Fabric-in-Her-Hands_ecKCU.png,girl
"Teenage Girl Studying with Laptop in Cozy, Book-Filled Room",A-Teenage-Girl's-Cozy-Online-Study-Setup_5Icxg.png,https://images.splitshire.com/full/A-Teenage-Girl's-Cozy-Online-Study-Setup_5Icxg.png,girl
Fitness Girl on Black Background,A-Fitness-Girl-on-a-Black-Background_7v46C.png,https://images.splitshire.com/full/A-Fitness-Girl-on-a-Black-Background_7v46C.png,girl
Fitness Girl on Black Background,A-Fitness-Girl-Against-a-Black-Background_gjtqD.png,https://images.splitshire.com/full/A-Fitness-Girl-Against-a-Black-Background_gjtqD.png,girl
Adult Woman Combing Her Hair Video,Adult-Girl-Brushing-Her-Hair-Video_xW3N2.png,https://images.splitshire.com/full/Adult-Girl-Brushing-Her-Hair-Video_xW3N2.png,girl
Girl Brushing Her Hair Video,A-Girl-Brushing-Her-Hair-Video_s3g6q.png,https://images.splitshire.com/full/A-Girl-Brushing-Her-Hair-Video_s3g6q.png,girl
Hijabi Girl Holding Flowers,A-Hijabi-Girl-Holding-Beautiful-Flowers_f5qgt.png,https://images.splitshire.com/full/A-Hijabi-Girl-Holding-Beautiful-Flowers_f5qgt.png,girl
"Pop Art Teenage Wasteland, Kawaii Girl Carwash with Fisheye Lens",The-Kawaii-Girl's-Pop-Art-Carwash-Scene_2C8UK.png,https://images.splitshire.com/full/The-Kawaii-Girl's-Pop-Art-Carwash-Scene_2C8UK.png,girl
Girl from Behind with Long Smooth Shiny Hair,"The-Girl-with-Long,-Shiny,-Smooth-Hair_9arbi.png","https://images.splitshire.com/full/The-Girl-with-Long,-Shiny,-Smooth-Hair_9arbi.png",girl
Girl with Long Shiny Hair View from Behind,"Girl-with-Long,-Shiny,-Smooth-Hair-from-Behind_9r0NR.png","https://images.splitshire.com/full/Girl-with-Long,-Shiny,-Smooth-Hair-from-Behind_9r0NR.png",girl
"Girl Finds Memory Trunk in Dusty Attic with Diary, Faded Photos, Pisa View and Typewriter on Modern Desk",Girl-Finds-Memory-Chest-in-Dusty-Attic_ZvDkO.png,https://images.splitshire.com/full/Girl-Finds-Memory-Chest-in-Dusty-Attic_ZvDkO.png,girl
Children's Book Style Illustration of Cute Girl on Grass with Big Red Flower,A-Girl-with-a-Big-Red-Flower-on-Sunny-Grass_H6qwE.png,https://images.splitshire.com/full/A-Girl-with-a-Big-Red-Flower-on-Sunny-Grass_H6qwE.png,girl
Beautiful Girl Portrait,A-Beautiful-Young-Lady_07Qyj.png,https://images.splitshire.com/full/A-Beautiful-Young-Lady_07Qyj.png,girl
Cyberpunk Girl Uploading Brain to Machine,The-Girl-Uploading-her-Brain-to-a-Machine_Saea9.png,https://images.splitshire.com/full/The-Girl-Uploading-her-Brain-to-a-Machine_Saea9.png,girl
Alien and Beautiful Girl in Love,Alien-Expressing-Love-to-a-Beautiful-Girl_iD9vO.png,https://images.splitshire.com/full/Alien-Expressing-Love-to-a-Beautiful-Girl_iD9vO.png,girl
Girl in Pink Dress Shopping with Cat Ear Accessory Illustration,A-Girl-Shopping-with-Cat-Ear-Accessory_zXubb.png,https://images.splitshire.com/full/A-Girl-Shopping-with-Cat-Ear-Accessory_zXubb.png,girl
Girl Leaning on Beige Couch Holding Sphere,Girl-Holding-Sphere-on-Couch-in-Casual-Clothes_LiuNJ.png,https://images.splitshire.com/full/Girl-Holding-Sphere-on-Couch-in-Casual-Clothes_LiuNJ.png,girl
Girl Leaning Back on Beige Couch Holding Sphere,Girl-Holding-Sphere-on-Couch_DTuYM.png,https://images.splitshire.com/full/Girl-Holding-Sphere-on-Couch_DTuYM.png,girl
Girl Photographer Capturing Damaged Road,Girl-Photographs-a-Broken-Road_8V9D5.png,https://images.splitshire.com/full/Girl-Photographs-a-Broken-Road_8V9D5.png,girl
Beautiful Sexy Girl,A-Beautiful-Attractive-Girl_ENa1B.png,https://images.splitshire.com/full/A-Beautiful-Attractive-Girl_ENa1B.png,girl
Dreamy Girl in Orange Hoodie with Headphones Painting,The-Dreamy-Girl-Lost-in-Music_EMazk.png,https://images.splitshire.com/full/The-Dreamy-Girl-Lost-in-Music_EMazk.png,girl
Censored Anime Girls Illustration,Censored-Anime-Girls_j2uwC.png,https://images.splitshire.com/full/Censored-Anime-Girls_j2uwC.png,girl
Censored Anime Girls Illustration,Anime-Girls-in-Modest-Attire_yt6vH.png,https://images.splitshire.com/full/Anime-Girls-in-Modest-Attire_yt6vH.png,girl
Girl in Bikini,A-Girl-in-Bikini-and-Partially-Nude-Girl_eiF8i.png,https://images.splitshire.com/full/A-Girl-in-Bikini-and-Partially-Nude-Girl_eiF8i.png,girl
Profile Picture of Cute Teenage Girl,"A-Teenage-Girl's-Cute-Profile-Picture,-Asia_NUYCP.png","https://images.splitshire.com/full/A-Teenage-Girl's-Cute-Profile-Picture,-Asia_NUYCP.png",girl
Girl Drawing in Summer Park,A-Girl-Drawing-in-the-Summer-Park_wPTxl.png,https://images.splitshire.com/full/A-Girl-Drawing-in-the-Summer-Park_wPTxl.png,girl
Girl Drawing in Summer Park,Girl-Drawing-in-a-Summer-Park_EvKwv.png,https://images.splitshire.com/full/Girl-Drawing-in-a-Summer-Park_EvKwv.png,girl
Photo of a Crying Woman,A-Girl-Who-is-Crying_fqWcT.png,https://images.splitshire.com/full/A-Girl-Who-is-Crying_fqWcT.png,girl
Girl Coding HTML for Website Creation,A-Girl-Creating-a-Website-Using-HTML_pUISg.png,https://images.splitshire.com/full/A-Girl-Creating-a-Website-Using-HTML_pUISg.png,girl
Crying Nigerian Village Girl with Baby on Lap,A-Desperate-Nigerian-Mother-and-Baby-on-Street_v3yRt.png,https://images.splitshire.com/full/A-Desperate-Nigerian-Mother-and-Baby-on-Street_v3yRt.png,girl
Sri Lankan Girl Fashion Shoot,The-Sri-Lankan-Girl's-Fashion-Photoshoot_Io1Mp.png,https://images.splitshire.com/full/The-Sri-Lankan-Girl's-Fashion-Photoshoot_Io1Mp.png,girl
Cute Tibetan Girl in Pixar Style,A-Cute-Tibetan-Girl-in-Pixar-Style_c9UV3.png,https://images.splitshire.com/full/A-Cute-Tibetan-Girl-in-Pixar-Style_c9UV3.png,girl
Blond Girl with Small Purple Bow,A-Blond-Girl-with-Small-Purple-Bow_NPBuH.png,https://images.splitshire.com/full/A-Blond-Girl-with-Small-Purple-Bow_NPBuH.png,girl
Girl Sitting on Chair in Dark Room Atmosphere,A-Girl-Sitting-Alone-in-a-Dark-Room_esAPR.png,https://images.splitshire.com/full/A-Girl-Sitting-Alone-in-a-Dark-Room_esAPR.png,girl
Teenage Girl Profile Picture,A-Teenage-Girl's-Cute-Profile-Picture_803Nt.png,https://images.splitshire.com/full/A-Teenage-Girl's-Cute-Profile-Picture_803Nt.png,girl
Pretty Kashmiri Girl in Traditional Attire,A-Kashmiri-Girl-in-Traditional-Attire_k5Fzv.png,https://images.splitshire.com/full/A-Kashmiri-Girl-in-Traditional-Attire_k5Fzv.png,girl
Girl Lying on Back with Glowing Chakras in Meditation,A-Girl-Meditating-with-Glowing-Chakras_ykVsC.png,https://images.splitshire.com/full/A-Girl-Meditating-with-Glowing-Chakras_ykVsC.png,girl
Pretty Elf Girl with Blue Skin in Magical Forest,A-Pretty-Elf-Girl-in-a-Magical-Forest_GZLYS.png,https://images.splitshire.com/full/A-Pretty-Elf-Girl-in-a-Magical-Forest_GZLYS.png,girl
"Cyber Girl on Giant Boombox Poster Art, Bright Colors, Mad Max Style Background",A-Cyber-Girl-on-a-Boombox-in-Mad-Max-Style_EyrFL.png,https://images.splitshire.com/full/A-Cyber-Girl-on-a-Boombox-in-Mad-Max-Style_EyrFL.png,girl
Mongolian Girl Disney Illustration Style,A-Disney-esque-Illustration-of-a-Cute-Mongolian-Girl_cqYHH.png,https://images.splitshire.com/full/A-Disney-esque-Illustration-of-a-Cute-Mongolian-Girl_cqYHH.png,girl
Teenage Girl Cute Profile Picture,A-Teenage-Girl's-Cute-Profile-Picture_LZWIV.png,https://images.splitshire.com/full/A-Teenage-Girl's-Cute-Profile-Picture_LZWIV.png,girl
Arab Girl in Swimming Outfit,An-Arabic-Girl-in-Swimming-Clothes_pkXUo.png,https://images.splitshire.com/full/An-Arabic-Girl-in-Swimming-Clothes_pkXUo.png,girl
Girl in Swimwear,A-Girl-in-a-Swimsuit_AQ0u9.png,https://images.splitshire.com/full/A-Girl-in-a-Swimsuit_AQ0u9.png,girl
Girl Walking Alone in Forest at Dawn Listening to Melody Background,Girl-Walking-Alone-in-Forest-at-Dawn_eoO9y.png,https://images.splitshire.com/full/Girl-Walking-Alone-in-Forest-at-Dawn_eoO9y.png,girl
Girl by the Sea,A-Girl-by-the-Sea_w1ujo.png,https://images.splitshire.com/full/A-Girl-by-the-Sea_w1ujo.png,girl
Photo of a Persian Girl,A-Portrait-of-a-Persian-Girl_bx8iu.png,https://images.splitshire.com/full/A-Portrait-of-a-Persian-Girl_bx8iu.png,girl
Chicano Girl in La Catrina Style with Gun,Chicano-Girl-in-La-Catrina-Style-with-Gun_2kMvk.png,https://images.splitshire.com/full/Chicano-Girl-in-La-Catrina-Style-with-Gun_2kMvk.png,girl
The Portrait of a Young Elf Girl,The-Portrait-of-a-Young-Elf-Girl_GGLCb.png,https://images.splitshire.com/full/The-Portrait-of-a-Young-Elf-Girl_GGLCb.png,girl
The Girl's Teary Eyes in Miyazaki Anime Style,The-Girl's-Teary-Eyes-in-Miyazaki-Anime-Style_3JH8h.png,https://images.splitshire.com/full/The-Girl's-Teary-Eyes-in-Miyazaki-Anime-Style_3JH8h.png,girl
Girl in Black Hoodie Strikes Heroic Pose,Girl-in-Black-Hoodie-Strikes-Heroic-Pose_oj9CA.png,https://images.splitshire.com/full/Girl-in-Black-Hoodie-Strikes-Heroic-Pose_oj9CA.png,girl
The Heroic Girl in a Black Hoodie,The-Heroic-Girl-in-a-Black-Hoodie_Ldky3.png,https://images.splitshire.com/full/The-Heroic-Girl-in-a-Black-Hoodie_Ldky3.png,girl
Two Girls Using MacBook Pro at Starbucks,Two-Girls-Using-MacBook-Pro-at-Starbucks_GzkH9.png,https://images.splitshire.com/full/Two-Girls-Using-MacBook-Pro-at-Starbucks_GzkH9.png,girl
A Young Girl Enjoying Beach Play,A-Young-Girl-Enjoying-Beach-Play_r971A.png,https://images.splitshire.com/full/A-Young-Girl-Enjoying-Beach-Play_r971A.png,girl
A British Girl Relaxing by Riverside at Sunrise,A-British-Girl-Relaxing-by-Riverside-at-Sunrise_A67cr.png,https://images.splitshire.com/full/A-British-Girl-Relaxing-by-Riverside-at-Sunrise_A67cr.png,girl
Indian Girl by the Misty Riverside at Sunrise,Indian-Girl-by-the-Misty-Riverside-at-Sunrise_xYQ8F.png,https://images.splitshire.com/full/Indian-Girl-by-the-Misty-Riverside-at-Sunrise_xYQ8F.png,girl
"Blonde Girl in Black Outfit, Cartoon Art","Blonde-Girl-in-Black-Outfit,-Cartoon-Art_cH9M7.png","https://images.splitshire.com/full/Blonde-Girl-in-Black-Outfit,-Cartoon-Art_cH9M7.png",girl
Orange Cat Standing Upright Holding Fish Tail in Daylight,Joyful-Cat-Holding-Fish-Tail-in-Daylight_qyByV.png,https://images.splitshire.com/full/Joyful-Cat-Holding-Fish-Tail-in-Daylight_qyByV.png,cat
Cartoon Fluffy Cat on Windowsill with Autumn Background,Cheerful-Orange-Cat-Enjoys-Autumn-on-Windowsill_IA3R6.png,https://images.splitshire.com/full/Cheerful-Orange-Cat-Enjoys-Autumn-on-Windowsill_IA3R6.png,cat
Serious Gangster Cat in Suit and Fedora with Gold Chains Walking in Urban Street,Gangster-Cat-with-Gold-Chains-in-Urban-Street_fH9te.png,https://images.splitshire.com/full/Gangster-Cat-with-Gold-Chains-in-Urban-Street_fH9te.png,cat
Gangster Cat in Suit and Fedora Walking Urban Street,Gangster-Cat-Strolls-Down-Graffiti-Strewn-Street_5CNBa.png,https://images.splitshire.com/full/Gangster-Cat-Strolls-Down-Graffiti-Strewn-Street_5CNBa.png,cat
Job Recruitment Banner Design,Eye-Catching-Banner-for-New-Employees-Search_OhfCB.png,https://images.splitshire.com/full/Eye-Catching-Banner-for-New-Employees-Search_OhfCB.png,cat
Comedy Cat Illustration,A-Funny-Cat-Making-Jokes_vrFi6.png,https://images.splitshire.com/full/A-Funny-Cat-Making-Jokes_vrFi6.png,cat
Catie's Dental Examination,Catie's-Dental-Check-up_w9ivk.png,https://images.splitshire.com/full/Catie's-Dental-Check-up_w9ivk.png,cat
Russian Tourist Cats Flying on Fairytale Carpet towards Sea Island,The-Cat-Family's-Magical-Carpet-Ride-to-Island_tc0G8.png,https://images.splitshire.com/full/The-Cat-Family's-Magical-Carpet-Ride-to-Island_tc0G8.png,cat
Fluffy White Cat with Butterfly on Nose in Rose Garden,A-White-Cat-with-Butterfly-on-Nose-in-Garden_Qtd4n.png,https://images.splitshire.com/full/A-White-Cat-with-Butterfly-on-Nose-in-Garden_Qtd4n.png,cat
Russian Tourist Cats Family Flying to Island on Magic Carpet,A-Family-of-Tourist-Cats-Flying-to-an-Island_HLOKV.png,https://images.splitshire.com/full/A-Family-of-Tourist-Cats-Flying-to-an-Island_HLOKV.png,cat
Human Working on Laptop with Cat Illustration,A-Man-Working-on-Laptop-with-Cat-Nearby_sqFqJ.png,https://images.splitshire.com/full/A-Man-Working-on-Laptop-with-Cat-Nearby_sqFqJ.png,cat
Cat Driving a Car,A-Cat-Driving-a-Car_3pIxb.png,https://images.splitshire.com/full/A-Cat-Driving-a-Car_3pIxb.png,cat
Cartoon Tiger-Striped Cat Returning Home with Worn Suitcase at Sunset,Orange-Striped-Cat-Returns-Home-at-Sunset_45sly.png,https://images.splitshire.com/full/Orange-Striped-Cat-Returns-Home-at-Sunset_45sly.png,cat
Society Ruled by Cats Illustration,The-Society-Ruled-by-Cats_rfZ7g.png,https://images.splitshire.com/full/The-Society-Ruled-by-Cats_rfZ7g.png,cat
"Stylish Cats in Colorful Gaming Room with Controllers, Digital Illustration",Two-Stylish-Cats-Gaming-in-Cozy-Sunset-Room_CUz1M.png,https://images.splitshire.com/full/Two-Stylish-Cats-Gaming-in-Cozy-Sunset-Room_CUz1M.png,cat
Eye-Catching Visual Hook for Single Photo,Eye-Catching-Viral-Photography-Visual-Hook_gqp4D.png,https://images.splitshire.com/full/Eye-Catching-Viral-Photography-Visual-Hook_gqp4D.png,cat
Cute Fluffy Orange Cat Sitting on a Windowsill in Sunlight,Cute-Fluffy-Orange-Cat-on-Sunlit-Windowsill_01GBU.png,https://images.splitshire.com/full/Cute-Fluffy-Orange-Cat-on-Sunlit-Windowsill_01GBU.png,cat
Orange Cats Fighting Video,Two-Orange-Cats-in-a-Fight-Video_ScTPo.png,https://images.splitshire.com/full/Two-Orange-Cats-in-a-Fight-Video_ScTPo.png,cat
Red Cat in Broad-Brimmed Hat with Sword Standing on Ship Deck,A-Red-Cat-Steering-a-Galleon-with-a-Sword_bi6ci.png,https://images.splitshire.com/full/A-Red-Cat-Steering-a-Galleon-with-a-Sword_bi6ci.png,cat
"Cozy Pastel Laundry Room with Cat, Basket, Wooden Shelves, and Italian Village View",A-Cat-Sleeps-in-Cozy-Pastel-Laundry-Room_P18Ti.png,https://images.splitshire.com/full/A-Cat-Sleeps-in-Cozy-Pastel-Laundry-Room_P18Ti.png,cat
"Cozy Laundry Room with Cat, Vintage Italian Village View",A-Cozy-Laundry-Room-in-Vintage-Italian-Village_dkWPd.png,https://images.splitshire.com/full/A-Cozy-Laundry-Room-in-Vintage-Italian-Village_dkWPd.png,cat
"Cheerful Giant Tabby Cat Blocking Traffic in Bangkok, Thailand",Giant-Tabby-Cat-Blocks-Traffic-in-Bangkok_T08sp.png,https://images.splitshire.com/full/Giant-Tabby-Cat-Blocks-Traffic-in-Bangkok_T08sp.png,cat
Dog and Cat Adoption Center,The-Dog-and-Cat-Adoption-Center_UkiGm.png,https://images.splitshire.com/full/The-Dog-and-Cat-Adoption-Center_UkiGm.png,cat
Puppy and Kitten Adoption Center,The-Dog-and-Cat-Adoption-Center_54OPS.png,https://images.splitshire.com/full/The-Dog-and-Cat-Adoption-Center_54OPS.png,cat
Dog and Cat Shelter,The-Dog-and-Cat-Shelter_2B2rg.png,https://images.splitshire.com/full/The-Dog-and-Cat-Shelter_2B2rg.png,cat
Black Market Cyber-Clinic in Ruined Cathedral with Surveillance Drone,Rebels-at-Hidden-Cyber-Clinic-Under-Drone-Surveillance_qLRSq.png,https://images.splitshire.com/full/Rebels-at-Hidden-Cyber-Clinic-Under-Drone-Surveillance_qLRSq.png,cat
Dancing Cat,The-Dancing-Cat_NNISS.png,https://images.splitshire.com/full/The-Dancing-Cat_NNISS.png,cat
Cozy Anime Café Interior with Napping Cats on Rainy Afternoon,Girl-Daydreaming-in-Cat-Café-on-Rainy-Afternoon_EjZ7G.png,https://images.splitshire.com/full/Girl-Daydreaming-in-Cat-Café-on-Rainy-Afternoon_EjZ7G.png,cat
Cartoon Neko Burger Illustration,A-Cute-Cat-Themed-Burger_S20aN.png,https://images.splitshire.com/full/A-Cute-Cat-Themed-Burger_S20aN.png,cat
Beautiful Cat Sitting Under Tree at Sunset,A-Cat-Relaxing-Under-a-Tree-at-Sunset_rspgG.png,https://images.splitshire.com/full/A-Cat-Relaxing-Under-a-Tree-at-Sunset_rspgG.png,cat
Kawaii Pastel Kitchen with Cat Baking Cupcakes Illustration,A-Cute-Cat-Bakes-Cupcakes-in-Pastel-Kitchen_6xaYI.png,https://images.splitshire.com/full/A-Cute-Cat-Bakes-Cupcakes-in-Pastel-Kitchen_6xaYI.png,cat
Red Cat in Broad-Brimmed Hat Steering Galleon with Sword and Albatross in Sky,A-Red-Cat-Steering-a-Galleon-with-a-Sword_aIN21.png,https://images.splitshire.com/full/A-Red-Cat-Steering-a-Galleon-with-a-Sword_aIN21.png,cat
Celestial Battle between Angels and Demons Above Crumbling Cathedral,Angels-and-Demons-Fight-Above-Ruined-Cathedral_xPmBc.png,https://images.splitshire.com/full/Angels-and-Demons-Fight-Above-Ruined-Cathedral_xPmBc.png,cat
Russia Day Card with Saint Basil's Cathedral and Russian Flag,A-Postcard-of-Saint-Basil's-Cathedral-with-Russian-Flag_tFDH1.png,https://images.splitshire.com/full/A-Postcard-of-Saint-Basil's-Cathedral-with-Russian-Flag_tFDH1.png,cat
Anthropomorphic Tabby Cat in Arabic Thobe with Eid Gifts at Hyper Alwafa Store Entrance,Joyful-Saudi-Cat-Shopping-for-Eid-Gifts_F7zbY.png,https://images.splitshire.com/full/Joyful-Saudi-Cat-Shopping-for-Eid-Gifts_F7zbY.png,cat
Valiant Female Paladin in Silver and Gold Armor with Glowing Sword and Divine Shield in Medieval Cathedral Ruins,The-Fierce-Paladin-in-Gold-Armor-in-Ruins_qsTG5.png,https://images.splitshire.com/full/The-Fierce-Paladin-in-Gold-Armor-in-Ruins_qsTG5.png,cat
Heroic Paladin Man in Shining Armor with Glowing Sword and Shield in Cathedral Ruins Setting,Heroic-Paladin-in-Glowing-Armor-at-Cathedral-Ruins_il5tX.png,https://images.splitshire.com/full/Heroic-Paladin-in-Glowing-Armor-at-Cathedral-Ruins_il5tX.png,cat
"Giant Orange Cat Singing in Bangkok Traffic Jam, Sunny Day",The-Giant-Singing-Cat-Amidst-Bangkok's-Traffic-Jam_9eu53.png,https://images.splitshire.com/full/The-Giant-Singing-Cat-Amidst-Bangkok's-Traffic-Jam_9eu53.png,cat
Close-Up Shot of Astonished Tabby Cat with Distorted Whiskers Against Blue Sky,Comical-Tabby-Cat's-Accidental-Selfie-in-Nature_FoaxH.png,https://images.splitshire.com/full/Comical-Tabby-Cat's-Accidental-Selfie-in-Nature_FoaxH.png,cat
Surprised White Persian Cat Selfie with Sky Background,A-Funny-Persian-Cat's-Accidental-Selfie_wDHjN.png,https://images.splitshire.com/full/A-Funny-Persian-Cat's-Accidental-Selfie_wDHjN.png,cat
3D Cartoon Orange Cat with Green Eyes in Afternoon Sun,Cute-Round-Orange-Cat-with-Green-Eyes-in-3D_uwK9r.png,https://images.splitshire.com/full/Cute-Round-Orange-Cat-with-Green-Eyes-in-3D_uwK9r.png,cat
AirPods Pro on White Background for Ecommerce Catalog,Airpods-Pro-on-White-Background-for-Ecommerce-Catalog_PVpoS.png,https://images.splitshire.com/full/Airpods-Pro-on-White-Background-for-Ecommerce-Catalog_PVpoS.png,cat
White Background Photo of AirPods Pro for Ecommerce,AirPods-Pro-on-White-Background-for-Ecommerce-Catalog_LWhM0.png,https://images.splitshire.com/full/AirPods-Pro-on-White-Background-for-Ecommerce-Catalog_LWhM0.png,cat
"White Cat Teacher in Traditional Classroom with Students, 3D Animation",The-Kindly-Cat-Teacher-in-Vintage-Classroom-Scene_Cub40.png,https://images.splitshire.com/full/The-Kindly-Cat-Teacher-in-Vintage-Classroom-Scene_Cub40.png,cat
3D Animated White Cat Teacher in Traditional Classroom,A-Whimsical-Cat-Teacher-in-a-Traditional-Classroom_gx0hu.png,https://images.splitshire.com/full/A-Whimsical-Cat-Teacher-in-a-Traditional-Classroom_gx0hu.png,cat
Close-Up Selfie of Surprised White Persian Cat with Sky Background,Persian-Cat's-Accidental-Selfie-under-a-Tree_GRGDo.png,https://images.splitshire.com/full/Persian-Cat's-Accidental-Selfie-under-a-Tree_GRGDo.png,cat
Full Body Shot of Humanoid Cat in Scottish Pattern Suit on Black Background,The-Well-Dressed-Cat-Humanoid-Against-Black-Background_ilUJR.png,https://images.splitshire.com/full/The-Well-Dressed-Cat-Humanoid-Against-Black-Background_ilUJR.png,cat
Dancing Cat,The-Dancing-Cat_LTiH6.png,https://images.splitshire.com/full/The-Dancing-Cat_LTiH6.png,cat
Funny Cat,The-Funny-Cat_DcyKi.png,https://images.splitshire.com/full/The-Funny-Cat_DcyKi.png,cat
Photo of a Bored Cat,A-Cat-Looking-Bored_KlERb.png,https://images.splitshire.com/full/A-Cat-Looking-Bored_KlERb.png,cat
Girl in Pink Dress Shopping with Cat Ear Accessory Illustration,A-Girl-Shopping-with-Cat-Ear-Accessory_zXubb.png,https://images.splitshire.com/full/A-Girl-Shopping-with-Cat-Ear-Accessory_zXubb.png,cat
Category of Shirts Image,The-Image-of-a-Shirt-Category_MzET4.png,https://images.splitshire.com/full/The-Image-of-a-Shirt-Category_MzET4.png,cat
Category Image of Golf Clothes,A-Display-of-Golf-Attire_QJOLi.png,https://images.splitshire.com/full/A-Display-of-Golf-Attire_QJOLi.png,cat
Dog Playing with Cat,A-Dog-Having-Fun-with-a-Cat_B7fXw.png,https://images.splitshire.com/full/A-Dog-Having-Fun-with-a-Cat_B7fXw.png,cat
Dancing Cat Photo,A-Cat-Doing-a-Dance_7lHfm.png,https://images.splitshire.com/full/A-Cat-Doing-a-Dance_7lHfm.png,cat
Dog Playing with Cat,A-Dog-Having-Fun-with-a-Cat_VOBI8.png,https://images.splitshire.com/full/A-Dog-Having-Fun-with-a-Cat_VOBI8.png,cat
Hotel for Animals With Cats and Dogs,A-Hotel-Filled-with-Cats-and-Dogs_nj3z4.png,https://images.splitshire.com/full/A-Hotel-Filled-with-Cats-and-Dogs_nj3z4.png,cat
Haunted Jungle Child with Amber Eyes and Wooden Cat Toy in Golden Ferns,A-Scared-Jungle-Child-Holding-Cat-Toy_zIwJo.png,https://images.splitshire.com/full/A-Scared-Jungle-Child-Holding-Cat-Toy_zIwJo.png,cat
Cat Programming on Computer,A-Cat-Engaged-in-Programming_QcsYS.png,https://images.splitshire.com/full/A-Cat-Engaged-in-Programming_QcsYS.png,cat
Programmed Cat Illustration,The-Programmed-Cat_V8Tp4.png,https://images.splitshire.com/full/The-Programmed-Cat_V8Tp4.png,cat
Animal Hotel with Cats and Dogs,The-Animal-Hotel-Filled-with-Cats-and-Dogs_AS9Qn.png,https://images.splitshire.com/full/The-Animal-Hotel-Filled-with-Cats-and-Dogs_AS9Qn.png,cat
Hotel for Animals with Cats and Dogs,The-Hotel-Exclusively-for-Cats-and-Dogs_NA4HA.png,https://images.splitshire.com/full/The-Hotel-Exclusively-for-Cats-and-Dogs_NA4HA.png,cat
Full-Body Cat in Dembow-Style Clothing with Urban Street Background,The-Cool-Cat-in-Urban-Street-Style-Outfit_uaASX.png,https://images.splitshire.com/full/The-Cool-Cat-in-Urban-Street-Style-Outfit_uaASX.png,cat
Full-Body Cat in Dembow-Style Clothing on Urban Street Background,The-Stylish-Cat-in-Urban-Dembow-Fashion_F64Xj.png,https://images.splitshire.com/full/The-Stylish-Cat-in-Urban-Dembow-Fashion_F64Xj.png,cat
Seductive Woman in Bikini Outfit Undressed with Married Man,Woman-in-Bikini-Catches-Married-Man's-Attention_vSv9P.png,https://images.splitshire.com/full/Woman-in-Bikini-Catches-Married-Man's-Attention_vSv9P.png,cat
Cat in a Kitchen Hall,A-Cat-in-the-Kitchen-Hall_fg8PQ.png,https://images.splitshire.com/full/A-Cat-in-the-Kitchen-Hall_fg8PQ.png,cat
Cat Relaxing in Bed,A-Cat-Resting-in-Bed_b8nB3.png,https://images.splitshire.com/full/A-Cat-Resting-in-Bed_b8nB3.png,cat
Cat Resting in Bed,A-Cat-Resting-in-the-Bed_2vKe6.png,https://images.splitshire.com/full/A-Cat-Resting-in-the-Bed_2vKe6.png,cat
Cat on Skateboard,A-Cat-on-a-Skateboard_wrGkA.png,https://images.splitshire.com/full/A-Cat-on-a-Skateboard_wrGkA.png,cat
Teenage Girl Mourning Beloved Cat in Quiet Bedroom,Teenage-Girl-Remembers-Deceased-Cat-in-Bedroom_bqJrj.png,https://images.splitshire.com/full/Teenage-Girl-Remembers-Deceased-Cat-in-Bedroom_bqJrj.png,cat
Teenage Girl Grieving Loss of Beloved Cat in Bedroom,Teenage-Girl-Remembers-Beloved-Cat-in-Bedroom_qwwmp.png,https://images.splitshire.com/full/Teenage-Girl-Remembers-Beloved-Cat-in-Bedroom_qwwmp.png,cat
Kawaii Anime Cat Illustration in Cozy Room with Books and Plants,A-Kawaii-Anime-Cat-in-Cozy-Book-filled-Room_GunsT.png,https://images.splitshire.com/full/A-Kawaii-Anime-Cat-in-Cozy-Book-filled-Room_GunsT.png,cat
Black Cat with Glasses Holding Pipe in Dark Room,"The-Elegant,-Mysterious-Cat-in-a-Dark-Room_SdwEA.png","https://images.splitshire.com/full/The-Elegant,-Mysterious-Cat-in-a-Dark-Room_SdwEA.png",cat
Anime-Style Urban Alley at Sunset with Thoughtful Man and Silhouetted Cat,Man-Reflecting-in-Sunset-Lit-Urban-Alley_1DWtp.png,https://images.splitshire.com/full/Man-Reflecting-in-Sunset-Lit-Urban-Alley_1DWtp.png,cat
Cute Cat Playing Guitar,A-Cute-Cat-Strumming-a-Guitar_hAxsx.png,https://images.splitshire.com/full/A-Cute-Cat-Strumming-a-Guitar_hAxsx.png,cat
"Cartoon Cat and Dog Wearing Sunglasses, One White, One Black",Cartoon-Cat-and-Dog-Sporting-Sunglasses_8eZsa.png,https://images.splitshire.com/full/Cartoon-Cat-and-Dog-Sporting-Sunglasses_8eZsa.png,cat
