Title,ImageName,URL,TAG
Modern Cartoon Dachshund Riding Skateboard with Shocked Cat Logo,Cartoon-Dachshund-and-Cat's-Silly-Skateboard-Adventure_P8mt5.png,https://images.splitshire.com/full/Cartoon-Dachshund-and-Cat's-Silly-Skateboard-Adventure_P8mt5.png,cat
The 8bit Pixel Cat in a Garden View,The-8bit-Pixel-Cat-in-a-Garden-View_eNV3B.png,https://images.splitshire.com/full/The-8bit-Pixel-Cat-in-a-Garden-View_eNV3B.png,cat
The Overhead View of 8-Bit Cat in Garden,The-Overhead-View-of-8-Bit-Cat-in-Garden_ZwX9e.png,https://images.splitshire.com/full/The-Overhead-View-of-8-Bit-Cat-in-Garden_ZwX9e.png,cat
Chicano Girl in La Catrina Style with Gun,Chicano-Girl-in-La-Catrina-Style-with-Gun_2kMvk.png,https://images.splitshire.com/full/Chicano-Girl-in-La-Catrina-Style-with-Gun_2kMvk.png,cat
The Cool Cat in Stylish Outfit on Urban Street,The-Cool-Cat-in-Stylish-Outfit-on-Urban-Street_Uop7X.png,https://images.splitshire.com/full/The-Cool-Cat-in-Stylish-Outfit-on-Urban-Street_Uop7X.png,cat
Elegant Cat Holding Pipe in Mysterious Dark Room,Elegant-Cat-Holding-Pipe-in-Mysterious-Dark-Room_pTBS3.png,https://images.splitshire.com/full/Elegant-Cat-Holding-Pipe-in-Mysterious-Dark-Room_pTBS3.png,cat
The Lawyer Cat and Angel Judge in Courtroom,The-Lawyer-Cat-and-Angel-Judge-in-Courtroom_dL4qQ.png,https://images.splitshire.com/full/The-Lawyer-Cat-and-Angel-Judge-in-Courtroom_dL4qQ.png,cat
A Cat and Baby Boy Playing Together,A-Cat-and-Baby-Boy-Playing-Together_gSid7.png,https://images.splitshire.com/full/A-Cat-and-Baby-Boy-Playing-Together_gSid7.png,cat
