Title,ImageName,URL,TAG
Orange Cat Standing Upright Holding Fish Tail in Daylight,default.png,https://www.splitshire.com/assets/images/default.png,cat
Cartoon Fluffy Cat on Windowsill with Autumn Background,default.png,https://www.splitshire.com/assets/images/default.png,cat
Serious Gangster Cat in Suit and Fedora with Gold Chains Walking in Urban Street,default.png,https://www.splitshire.com/assets/images/default.png,cat
Gangster Cat in Suit and Fedora Walking Urban Street,default.png,https://www.splitshire.com/assets/images/default.png,cat
Job Recruitment Banner Design,default.png,https://www.splitshire.com/assets/images/default.png,cat
Comedy Cat Illustration,default.png,https://www.splitshire.com/assets/images/default.png,cat
Catie's Dental Examination,default.png,https://www.splitshire.com/assets/images/default.png,cat
Russian Tourist Cats Flying on Fairytale Carpet towards Sea Island,default.png,https://www.splitshire.com/assets/images/default.png,cat
Fluffy White Cat with Butterfly on Nose in Rose Garden,default.png,https://www.splitshire.com/assets/images/default.png,cat
Russian Tourist Cats Family Flying to Island on Magic Carpet,default.png,https://www.splitshire.com/assets/images/default.png,cat
Human Working on Laptop with Cat Illustration,default.png,https://www.splitshire.com/assets/images/default.png,cat
Cat Driving a Car,default.png,https://www.splitshire.com/assets/images/default.png,cat
Cartoon Tiger-Striped Cat Returning Home with Worn Suitcase at Sunset,default.png,https://www.splitshire.com/assets/images/default.png,cat
Society Ruled by Cats Illustration,default.png,https://www.splitshire.com/assets/images/default.png,cat
"Stylish Cats in Colorful Gaming Room with Controllers, Digital Illustration",default.png,https://www.splitshire.com/assets/images/default.png,cat
Eye-Catching Visual Hook for Single Photo,default.png,https://www.splitshire.com/assets/images/default.png,cat
Cute Fluffy Orange Cat Sitting on a Windowsill in Sunlight,default.png,https://www.splitshire.com/assets/images/default.png,cat
Orange Cats Fighting Video,default.png,https://www.splitshire.com/assets/images/default.png,cat
Red Cat in Broad-Brimmed Hat with Sword Standing on Ship Deck,default.png,https://www.splitshire.com/assets/images/default.png,cat
"Cozy Pastel Laundry Room with Cat, Basket, Wooden Shelves, and Italian Village View",default.png,https://www.splitshire.com/assets/images/default.png,cat
"Cozy Laundry Room with Cat, Vintage Italian Village View",default.png,https://www.splitshire.com/assets/images/default.png,cat
"Cheerful Giant Tabby Cat Blocking Traffic in Bangkok, Thailand",default.png,https://www.splitshire.com/assets/images/default.png,cat
Dog and Cat Adoption Center,default.png,https://www.splitshire.com/assets/images/default.png,cat
Puppy and Kitten Adoption Center,default.png,https://www.splitshire.com/assets/images/default.png,cat
Dog and Cat Shelter,default.png,https://www.splitshire.com/assets/images/default.png,cat
Black Market Cyber-Clinic in Ruined Cathedral with Surveillance Drone,default.png,https://www.splitshire.com/assets/images/default.png,cat
Dancing Cat,default.png,https://www.splitshire.com/assets/images/default.png,cat
Cozy Anime Café Interior with Napping Cats on Rainy Afternoon,default.png,https://www.splitshire.com/assets/images/default.png,cat
Cartoon Neko Burger Illustration,default.png,https://www.splitshire.com/assets/images/default.png,cat
Beautiful Cat Sitting Under Tree at Sunset,default.png,https://www.splitshire.com/assets/images/default.png,cat
Kawaii Pastel Kitchen with Cat Baking Cupcakes Illustration,default.png,https://www.splitshire.com/assets/images/default.png,cat
Red Cat in Broad-Brimmed Hat Steering Galleon with Sword and Albatross in Sky,default.png,https://www.splitshire.com/assets/images/default.png,cat
Celestial Battle between Angels and Demons Above Crumbling Cathedral,default.png,https://www.splitshire.com/assets/images/default.png,cat
Russia Day Card with Saint Basil's Cathedral and Russian Flag,default.png,https://www.splitshire.com/assets/images/default.png,cat
Anthropomorphic Tabby Cat in Arabic Thobe with Eid Gifts at Hyper Alwafa Store Entrance,default.png,https://www.splitshire.com/assets/images/default.png,cat
Valiant Female Paladin in Silver and Gold Armor with Glowing Sword and Divine Shield in Medieval Cathedral Ruins,default.png,https://www.splitshire.com/assets/images/default.png,cat
Heroic Paladin Man in Shining Armor with Glowing Sword and Shield in Cathedral Ruins Setting,default.png,https://www.splitshire.com/assets/images/default.png,cat
"Giant Orange Cat Singing in Bangkok Traffic Jam, Sunny Day",default.png,https://www.splitshire.com/assets/images/default.png,cat
Close-Up Shot of Astonished Tabby Cat with Distorted Whiskers Against Blue Sky,default.png,https://www.splitshire.com/assets/images/default.png,cat
Surprised White Persian Cat Selfie with Sky Background,default.png,https://www.splitshire.com/assets/images/default.png,cat
3D Cartoon Orange Cat with Green Eyes in Afternoon Sun,default.png,https://www.splitshire.com/assets/images/default.png,cat
AirPods Pro on White Background for Ecommerce Catalog,default.png,https://www.splitshire.com/assets/images/default.png,cat
White Background Photo of AirPods Pro for Ecommerce,default.png,https://www.splitshire.com/assets/images/default.png,cat
"White Cat Teacher in Traditional Classroom with Students, 3D Animation",default.png,https://www.splitshire.com/assets/images/default.png,cat
3D Animated White Cat Teacher in Traditional Classroom,default.png,https://www.splitshire.com/assets/images/default.png,cat
Close-Up Selfie of Surprised White Persian Cat with Sky Background,default.png,https://www.splitshire.com/assets/images/default.png,cat
Full Body Shot of Humanoid Cat in Scottish Pattern Suit on Black Background,default.png,https://www.splitshire.com/assets/images/default.png,cat
Dancing Cat,default.png,https://www.splitshire.com/assets/images/default.png,cat
Funny Cat,default.png,https://www.splitshire.com/assets/images/default.png,cat
Photo of a Bored Cat,default.png,https://www.splitshire.com/assets/images/default.png,cat
Girl in Pink Dress Shopping with Cat Ear Accessory Illustration,default.png,https://www.splitshire.com/assets/images/default.png,cat
Category of Shirts Image,default.png,https://www.splitshire.com/assets/images/default.png,cat
Category Image of Golf Clothes,default.png,https://www.splitshire.com/assets/images/default.png,cat
Dog Playing with Cat,default.png,https://www.splitshire.com/assets/images/default.png,cat
Dancing Cat Photo,default.png,https://www.splitshire.com/assets/images/default.png,cat
Dog Playing with Cat,default.png,https://www.splitshire.com/assets/images/default.png,cat
Hotel for Animals With Cats and Dogs,default.png,https://www.splitshire.com/assets/images/default.png,cat
Haunted Jungle Child with Amber Eyes and Wooden Cat Toy in Golden Ferns,default.png,https://www.splitshire.com/assets/images/default.png,cat
Cat Programming on Computer,default.png,https://www.splitshire.com/assets/images/default.png,cat
Programmed Cat Illustration,default.png,https://www.splitshire.com/assets/images/default.png,cat
Animal Hotel with Cats and Dogs,default.png,https://www.splitshire.com/assets/images/default.png,cat
Hotel for Animals with Cats and Dogs,default.png,https://www.splitshire.com/assets/images/default.png,cat
Full-Body Cat in Dembow-Style Clothing with Urban Street Background,default.png,https://www.splitshire.com/assets/images/default.png,cat
Full-Body Cat in Dembow-Style Clothing on Urban Street Background,default.png,https://www.splitshire.com/assets/images/default.png,cat
Seductive Woman in Bikini Outfit Undressed with Married Man,default.png,https://www.splitshire.com/assets/images/default.png,cat
Cat in a Kitchen Hall,default.png,https://www.splitshire.com/assets/images/default.png,cat
Cat Relaxing in Bed,default.png,https://www.splitshire.com/assets/images/default.png,cat
Cat Resting in Bed,default.png,https://www.splitshire.com/assets/images/default.png,cat
Cat on Skateboard,default.png,https://www.splitshire.com/assets/images/default.png,cat
Teenage Girl Mourning Beloved Cat in Quiet Bedroom,default.png,https://www.splitshire.com/assets/images/default.png,cat
Teenage Girl Grieving Loss of Beloved Cat in Bedroom,default.png,https://www.splitshire.com/assets/images/default.png,cat
Kawaii Anime Cat Illustration in Cozy Room with Books and Plants,default.png,https://www.splitshire.com/assets/images/default.png,cat
Black Cat with Glasses Holding Pipe in Dark Room,default.png,https://www.splitshire.com/assets/images/default.png,cat
Anime-Style Urban Alley at Sunset with Thoughtful Man and Silhouetted Cat,default.png,https://www.splitshire.com/assets/images/default.png,cat
Cute Cat Playing Guitar,default.png,https://www.splitshire.com/assets/images/default.png,cat
"Cartoon Cat and Dog Wearing Sunglasses, One White, One Black",default.png,https://www.splitshire.com/assets/images/default.png,cat
Modern Cartoon Dachshund Riding Skateboard with Shocked Cat Logo,default.png,https://www.splitshire.com/assets/images/default.png,cat
The 8bit Pixel Cat in a Garden View,default.png,https://www.splitshire.com/assets/images/default.png,cat
The Overhead View of 8-Bit Cat in Garden,default.png,https://www.splitshire.com/assets/images/default.png,cat
Chicano Girl in La Catrina Style with Gun,default.png,https://www.splitshire.com/assets/images/default.png,cat
The Cool Cat in Stylish Outfit on Urban Street,default.png,https://www.splitshire.com/assets/images/default.png,cat
Elegant Cat Holding Pipe in Mysterious Dark Room,default.png,https://www.splitshire.com/assets/images/default.png,cat
The Lawyer Cat and Angel Judge in Courtroom,default.png,https://www.splitshire.com/assets/images/default.png,cat
A Cat and Baby Boy Playing Together,default.png,https://www.splitshire.com/assets/images/default.png,cat
Confused Girl with Hijab Portrait,default.png,https://www.splitshire.com/assets/images/default.png,girl
Cute Girl in Colorful Dress Finding a Very Big Colorful Egg Turning into Lolly Katie,default.png,https://www.splitshire.com/assets/images/default.png,girl
Cute Girl in Colorful Dress Finds Big Multicolored Egg,default.png,https://www.splitshire.com/assets/images/default.png,girl
Censored Anime Girls Illustration,default.png,https://www.splitshire.com/assets/images/default.png,girl
Running Girl in Sportswear PNG,default.png,https://www.splitshire.com/assets/images/default.png,girl
Boy Comforting His Crying Girlfriend,default.png,https://www.splitshire.com/assets/images/default.png,girl
13 Year Old Girl Waving Hello,default.png,https://www.splitshire.com/assets/images/default.png,girl
Hijabi Girl Holding Flowers,default.png,https://www.splitshire.com/assets/images/default.png,girl
Sad Romantic Scene of Separating Boy and Girl,default.png,https://www.splitshire.com/assets/images/default.png,girl
Sad Romantic Scene of Girl and Boy Separating,default.png,https://www.splitshire.com/assets/images/default.png,girl
Girl Walking on the Beach,default.png,https://www.splitshire.com/assets/images/default.png,girl
Girls Coaching Session,default.png,https://www.splitshire.com/assets/images/default.png,girl
Smiling Girl with Burgundy Pixie Cut Drinking Cocktail on Beach Lounge,default.png,https://www.splitshire.com/assets/images/default.png,girl
Laughing Girl,default.png,https://www.splitshire.com/assets/images/default.png,girl
Laughing Girl,default.png,https://www.splitshire.com/assets/images/default.png,girl
Drawing of Girl with Large Chest,default.png,https://www.splitshire.com/assets/images/default.png,girl
Illustration of Girl in Swimwear,default.png,https://www.splitshire.com/assets/images/default.png,girl
Little Girl Playing in the Sea,default.png,https://www.splitshire.com/assets/images/default.png,girl
Little Girl Playing in the Sea,default.png,https://www.splitshire.com/assets/images/default.png,girl
Girl with Grey Eyes Writing Letter in Tears,default.png,https://www.splitshire.com/assets/images/default.png,girl
Happy Birthday Girl Video,default.png,https://www.splitshire.com/assets/images/default.png,girl
Smoking Girl Photo,default.png,https://www.splitshire.com/assets/images/default.png,girl
Fun Girl's Funniest Moment,default.png,https://www.splitshire.com/assets/images/default.png,girl
Young Woman on Beach at Sunrise Holding Blue Rose,default.png,https://www.splitshire.com/assets/images/default.png,girl
Teen Girl with Blue Rose on Sunrise Beach,default.png,https://www.splitshire.com/assets/images/default.png,girl
Sikh Girl in Traditional Dummala Attire,default.png,https://www.splitshire.com/assets/images/default.png,girl
Traditional Sikh Girl in Attire,default.png,https://www.splitshire.com/assets/images/default.png,girl
POV Transformation of Mysterious Girl into Dragon,default.png,https://www.splitshire.com/assets/images/default.png,girl
Female Planning to Hang Out,default.png,https://www.splitshire.com/assets/images/default.png,girl
Anime Girl Wearing Bra Full Body Image,default.png,https://www.splitshire.com/assets/images/default.png,girl
Anime Girl Holding Banana Illustration,default.png,https://www.splitshire.com/assets/images/default.png,girl
Censored Anime Girl Illustration,default.png,https://www.splitshire.com/assets/images/default.png,girl
"Teenage Girl with Ponytail, Brown Eyes, and White Skin Wearing Hoodie",default.png,https://www.splitshire.com/assets/images/default.png,girl
Crying Girl,default.png,https://www.splitshire.com/assets/images/default.png,girl
Girls Sitting Beside River,default.png,https://www.splitshire.com/assets/images/default.png,girl
Smiling Girl Holding Oranges on Orange Shades Background,default.png,https://www.splitshire.com/assets/images/default.png,girl
Doctor Performing Girl's Skin Treatment,default.png,https://www.splitshire.com/assets/images/default.png,girl
Doctor Performing Skin Treatment on Girl,default.png,https://www.splitshire.com/assets/images/default.png,girl
Girl with Red Hood in Dark Ambient Lighting,default.png,https://www.splitshire.com/assets/images/default.png,girl
Smiling Girl Riding Roller Skates,default.png,https://www.splitshire.com/assets/images/default.png,girl
Smiling Girl Skating on Rollerblades,default.png,https://www.splitshire.com/assets/images/default.png,girl
Topless Female Photo,default.png,https://www.splitshire.com/assets/images/default.png,girl
Smiling Girl Roller Skating,default.png,https://www.splitshire.com/assets/images/default.png,girl
Girl Swimming at Beach,default.png,https://www.splitshire.com/assets/images/default.png,girl
Girl Examining Summer Kulirka Fabric,default.png,https://www.splitshire.com/assets/images/default.png,girl
"Teenage Girl Studying with Laptop in Cozy, Book-Filled Room",default.png,https://www.splitshire.com/assets/images/default.png,girl
Fitness Girl on Black Background,default.png,https://www.splitshire.com/assets/images/default.png,girl
Fitness Girl on Black Background,default.png,https://www.splitshire.com/assets/images/default.png,girl
Adult Woman Combing Her Hair Video,default.png,https://www.splitshire.com/assets/images/default.png,girl
Girl Brushing Her Hair Video,default.png,https://www.splitshire.com/assets/images/default.png,girl
Hijabi Girl Holding Flowers,default.png,https://www.splitshire.com/assets/images/default.png,girl
"Pop Art Teenage Wasteland, Kawaii Girl Carwash with Fisheye Lens",default.png,https://www.splitshire.com/assets/images/default.png,girl
Girl from Behind with Long Smooth Shiny Hair,default.png,https://www.splitshire.com/assets/images/default.png,girl
Girl with Long Shiny Hair View from Behind,default.png,https://www.splitshire.com/assets/images/default.png,girl
"Girl Finds Memory Trunk in Dusty Attic with Diary, Faded Photos, Pisa View and Typewriter on Modern Desk",default.png,https://www.splitshire.com/assets/images/default.png,girl
Children's Book Style Illustration of Cute Girl on Grass with Big Red Flower,default.png,https://www.splitshire.com/assets/images/default.png,girl
Beautiful Girl Portrait,default.png,https://www.splitshire.com/assets/images/default.png,girl
Cyberpunk Girl Uploading Brain to Machine,default.png,https://www.splitshire.com/assets/images/default.png,girl
Alien and Beautiful Girl in Love,default.png,https://www.splitshire.com/assets/images/default.png,girl
Girl in Pink Dress Shopping with Cat Ear Accessory Illustration,default.png,https://www.splitshire.com/assets/images/default.png,girl
Girl Leaning on Beige Couch Holding Sphere,default.png,https://www.splitshire.com/assets/images/default.png,girl
Girl Leaning Back on Beige Couch Holding Sphere,default.png,https://www.splitshire.com/assets/images/default.png,girl
Girl Photographer Capturing Damaged Road,default.png,https://www.splitshire.com/assets/images/default.png,girl
Beautiful Sexy Girl,default.png,https://www.splitshire.com/assets/images/default.png,girl
Dreamy Girl in Orange Hoodie with Headphones Painting,default.png,https://www.splitshire.com/assets/images/default.png,girl
Censored Anime Girls Illustration,default.png,https://www.splitshire.com/assets/images/default.png,girl
Censored Anime Girls Illustration,default.png,https://www.splitshire.com/assets/images/default.png,girl
Girl in Bikini,default.png,https://www.splitshire.com/assets/images/default.png,girl
Profile Picture of Cute Teenage Girl,default.png,https://www.splitshire.com/assets/images/default.png,girl
Girl Drawing in Summer Park,default.png,https://www.splitshire.com/assets/images/default.png,girl
Girl Drawing in Summer Park,default.png,https://www.splitshire.com/assets/images/default.png,girl
Photo of a Crying Woman,default.png,https://www.splitshire.com/assets/images/default.png,girl
Girl Coding HTML for Website Creation,default.png,https://www.splitshire.com/assets/images/default.png,girl
Crying Nigerian Village Girl with Baby on Lap,default.png,https://www.splitshire.com/assets/images/default.png,girl
Sri Lankan Girl Fashion Shoot,default.png,https://www.splitshire.com/assets/images/default.png,girl
Cute Tibetan Girl in Pixar Style,default.png,https://www.splitshire.com/assets/images/default.png,girl
Blond Girl with Small Purple Bow,default.png,https://www.splitshire.com/assets/images/default.png,girl
Girl Sitting on Chair in Dark Room Atmosphere,default.png,https://www.splitshire.com/assets/images/default.png,girl
Teenage Girl Profile Picture,default.png,https://www.splitshire.com/assets/images/default.png,girl
Pretty Kashmiri Girl in Traditional Attire,default.png,https://www.splitshire.com/assets/images/default.png,girl
Girl Lying on Back with Glowing Chakras in Meditation,default.png,https://www.splitshire.com/assets/images/default.png,girl
Pretty Elf Girl with Blue Skin in Magical Forest,default.png,https://www.splitshire.com/assets/images/default.png,girl
"Cyber Girl on Giant Boombox Poster Art, Bright Colors, Mad Max Style Background",default.png,https://www.splitshire.com/assets/images/default.png,girl
Mongolian Girl Disney Illustration Style,default.png,https://www.splitshire.com/assets/images/default.png,girl
Teenage Girl Cute Profile Picture,default.png,https://www.splitshire.com/assets/images/default.png,girl
Arab Girl in Swimming Outfit,default.png,https://www.splitshire.com/assets/images/default.png,girl
Girl in Swimwear,default.png,https://www.splitshire.com/assets/images/default.png,girl
Girl Walking Alone in Forest at Dawn Listening to Melody Background,default.png,https://www.splitshire.com/assets/images/default.png,girl
Girl by the Sea,default.png,https://www.splitshire.com/assets/images/default.png,girl
Photo of a Persian Girl,default.png,https://www.splitshire.com/assets/images/default.png,girl
Chicano Girl in La Catrina Style with Gun,default.png,https://www.splitshire.com/assets/images/default.png,girl
The Portrait of a Young Elf Girl,default.png,https://www.splitshire.com/assets/images/default.png,girl
The Girl's Teary Eyes in Miyazaki Anime Style,default.png,https://www.splitshire.com/assets/images/default.png,girl
Girl in Black Hoodie Strikes Heroic Pose,default.png,https://www.splitshire.com/assets/images/default.png,girl
The Heroic Girl in a Black Hoodie,default.png,https://www.splitshire.com/assets/images/default.png,girl
Two Girls Using MacBook Pro at Starbucks,default.png,https://www.splitshire.com/assets/images/default.png,girl
A Young Girl Enjoying Beach Play,default.png,https://www.splitshire.com/assets/images/default.png,girl
A British Girl Relaxing by Riverside at Sunrise,default.png,https://www.splitshire.com/assets/images/default.png,girl
Indian Girl by the Misty Riverside at Sunrise,default.png,https://www.splitshire.com/assets/images/default.png,girl
"Blonde Girl in Black Outfit, Cartoon Art",default.png,https://www.splitshire.com/assets/images/default.png,girl
Confused Girl with Hijab Portrait,A-Confused-Girl-Wearing-a-Beautiful-Hijab_VqukD.png,https://images.splitshire.com/full/A-Confused-Girl-Wearing-a-Beautiful-Hijab_VqukD.png,girl
Cute Girl in Colorful Dress Finding a Very Big Colorful Egg Turning into Lolly Katie,A-Cute-Girl-Finds-a-Magical-Colorful-Egg_jhhoX.png,https://images.splitshire.com/full/A-Cute-Girl-Finds-a-Magical-Colorful-Egg_jhhoX.png,girl
Cute Girl in Colorful Dress Finds Big Multicolored Egg,A-Cute-Girl-Finds-a-Magical-Colorful-Egg_tYxg8.png,https://images.splitshire.com/full/A-Cute-Girl-Finds-a-Magical-Colorful-Egg_tYxg8.png,girl
Censored Anime Girls Illustration,Anime-Girls-in-Modest-Attire_jzQA3.png,https://images.splitshire.com/full/Anime-Girls-in-Modest-Attire_jzQA3.png,girl
Running Girl in Sportswear PNG,A-Girl-Running-in-Sports-Attire-(png)_U60in.png,https://images.splitshire.com/full/A-Girl-Running-in-Sports-Attire-(png)_U60in.png,girl
Boy Comforting His Crying Girlfriend,The-Boy-Who-Won't-Let-His-Love-Cry_cmJ6o.png,https://images.splitshire.com/full/The-Boy-Who-Won't-Let-His-Love-Cry_cmJ6o.png,girl
13 Year Old Girl Waving Hello,The-13-Year-Old-Beautiful-Girl-Greeting-Super-Batu_dTwZ0.png,https://images.splitshire.com/full/The-13-Year-Old-Beautiful-Girl-Greeting-Super-Batu_dTwZ0.png,girl
Hijabi Girl Holding Flowers,A-Hijabi-Girl-Holding-Beautiful-Flowers_rSNNK.png,https://images.splitshire.com/full/A-Hijabi-Girl-Holding-Beautiful-Flowers_rSNNK.png,girl
Sad Romantic Scene of Separating Boy and Girl,A-Tender-Farewell-Between-a-Boy-and-Girl_QZ3wo.png,https://images.splitshire.com/full/A-Tender-Farewell-Between-a-Boy-and-Girl_QZ3wo.png,girl
Sad Romantic Scene of Girl and Boy Separating,A-Sad-Farewell-Between-Young-Love_jkGbg.png,https://images.splitshire.com/full/A-Sad-Farewell-Between-Young-Love_jkGbg.png,girl
Girl Walking on the Beach,Girl-Walking-on-the-Beach_XQpHW.png,https://images.splitshire.com/full/Girl-Walking-on-the-Beach_XQpHW.png,girl
Girls Coaching Session,Girls-Leading-the-Coaching-Session_8cxdt.png,https://images.splitshire.com/full/Girls-Leading-the-Coaching-Session_8cxdt.png,girl
Smiling Girl with Burgundy Pixie Cut Drinking Cocktail on Beach Lounge,A-Girl-Relaxing-by-the-River-with-Laptop_QxVpo.png,https://images.splitshire.com/full/A-Girl-Relaxing-by-the-River-with-Laptop_QxVpo.png,girl
Laughing Girl,A-Girl-Who-is-Laughing_Xmx9m.png,https://images.splitshire.com/full/A-Girl-Who-is-Laughing_Xmx9m.png,girl
Laughing Girl,A-Girl-Laughing-Joyfully_FkyEY.png,https://images.splitshire.com/full/A-Girl-Laughing-Joyfully_FkyEY.png,girl
Drawing of Girl with Large Chest,Drawing-of-a-Girl-with-a-Large-Chest_tsrE2.png,https://images.splitshire.com/full/Drawing-of-a-Girl-with-a-Large-Chest_tsrE2.png,girl
Illustration of Girl in Swimwear,A-Girl-in-Beach-Clothes_I21vH.png,https://images.splitshire.com/full/A-Girl-in-Beach-Clothes_I21vH.png,girl
Little Girl Playing in the Sea,A-Little-Girl-Playing-in-the-Sea_dmVay.png,https://images.splitshire.com/full/A-Little-Girl-Playing-in-the-Sea_dmVay.png,girl
Little Girl Playing in the Sea,A-Little-Girl-Playing-in-the-Sea_A4Ucm.png,https://images.splitshire.com/full/A-Little-Girl-Playing-in-the-Sea_A4Ucm.png,girl
Girl with Grey Eyes Writing Letter in Tears,A-Girl-with-Gray-Eyes-Writing-a-Teary-Letter_MTuaF.png,https://images.splitshire.com/full/A-Girl-with-Gray-Eyes-Writing-a-Teary-Letter_MTuaF.png,girl
Happy Birthday Girl Video,The-Birthday-Girl's-Video_u7QXI.png,https://images.splitshire.com/full/The-Birthday-Girl's-Video_u7QXI.png,girl
Smoking Girl Photo,A-Girl-Smoking_xj8Bl.png,https://images.splitshire.com/full/A-Girl-Smoking_xj8Bl.png,girl
Fun Girl's Funniest Moment,A-Girl's-Happiest-Moment_lfwkH.png,https://images.splitshire.com/full/A-Girl's-Happiest-Moment_lfwkH.png,girl
Young Woman on Beach at Sunrise Holding Blue Rose,A-Girl-with-Blue-Rose-on-Sunrise-Beach_RQlyC.png,https://images.splitshire.com/full/A-Girl-with-Blue-Rose-on-Sunrise-Beach_RQlyC.png,girl
Teen Girl with Blue Rose on Sunrise Beach,A-Teen-Girl-with-Blue-Rose-at-Sunrise_haQsH.png,https://images.splitshire.com/full/A-Teen-Girl-with-Blue-Rose-at-Sunrise_haQsH.png,girl
Sikh Girl in Traditional Dummala Attire,A-Sikh-Girl-in-Traditional-Dummala-Attire_QgPbn.png,https://images.splitshire.com/full/A-Sikh-Girl-in-Traditional-Dummala-Attire_QgPbn.png,girl
Traditional Sikh Girl in Attire,A-Sikh-Girl-in-Traditional-Attire_DXeg2.png,https://images.splitshire.com/full/A-Sikh-Girl-in-Traditional-Attire_DXeg2.png,girl
POV Transformation of Mysterious Girl into Dragon,A-Mysterious-Girl-Transforms-into-a-Dragon_N6MvX.png,https://images.splitshire.com/full/A-Mysterious-Girl-Transforms-into-a-Dragon_N6MvX.png,girl
Female Planning to Hang Out,A-Girl-Pretending-We-Will-Hang-Out_ZUQ82.png,https://images.splitshire.com/full/A-Girl-Pretending-We-Will-Hang-Out_ZUQ82.png,girl
Anime Girl Wearing Bra Full Body Image,Anime-Girl-in-Bra-on-Full-Display_zz2Ca.png,https://images.splitshire.com/full/Anime-Girl-in-Bra-on-Full-Display_zz2Ca.png,girl
Anime Girl Holding Banana Illustration,Anime-Girl-Eating-a-Banana_718lz.png,https://images.splitshire.com/full/Anime-Girl-Eating-a-Banana_718lz.png,girl
